"user_id","user_location","tweet_text","tweet_created_at","tweet_retweet_count","user_statuses_count","user_followers_count","user_friends_count","tweet_place","tweet_text_clean"
1382437711,"Oslo/Tarjei's dimple","RT @smilesnoora: guys!! i ran into willhelm at ikea today!! https://t.co/9taKzdl6yh","2017-08-24",8,33965,"3708",3704,"","   guys   i ran into willhelm at ikea today      t co  taKzdl yh"
6480152,"Belgrade - Oslo","sat vremena mog zivota pokusavajuci da kupim online sa #Ikea sajta, jer ne mozes da kupis online preko @IKEA_Srbija ako imas Mac!!!!","2017-08-25",0,10545,"2862",492,"","sat vremena mog zivota pokusavajuci da kupim online sa  Ikea sajta  jer ne mozes da kupis online preko ako imas Mac    "
6480152,"Belgrade - Oslo","a i preko mobilnog telefona, odnosno browsera na mobilnom, deo za kupovinu ne radi @IKEA_Srbija #fail","2017-08-25",0,10545,"2862",492,"","a i preko mobilnog telefona  odnosno browsera na mobilnom  deo za kupovinu ne radi  fail"
18690377,"Oslo","@skattebu IKEA-katalogen!","2017-08-25",0,22784,"715",259,""," IKEA katalogen "
25555130,"Oslo - Stockholm - Copenhagen","Som om ikke det å få IKEA-katalogen i postkassa var fett nok, kan du også møte IKEA (og oss) i Oslo i... https://t.co/CZVbikWEjY","2017-08-25",0,996,"595",619,"","Som om ikke det å få IKEA katalogen i postkassa var fett nok  kan du også møte IKEA  og oss  i Oslo i       t co CZVbikWEjY"
392045287,"Oslo, Norge","RT @heyingridhey: Altså Ikea dette er jo IKKE greit https://t.co/6et8xOu1MG","2017-08-25",13,69003,"5888",4427,"","   Altså Ikea dette er jo IKKE greit    t co  et xOu MG"
27485335,"Oslo, Norway, Noreg, Norge","RT @dezeen: BIG""s spiky towers will include 500 compact ""youth rooms"" with floorplans of 30 square metres https://t.co/ruVugB0IVC","2017-08-25",18,72851,"76257",83855,"","   BIG s spiky towers will include compact  youth rooms  with floorplans of square metres    t co ruVugB IVC"
3233716409,"I vakreste byen Oslo i Norge","Degene die bv in de Ikea moeder en zoon onthoofdde was ook een gelovige die de opdracht uit de koran uitvoerde. De… https://t.co/btTQ0EADvC","2017-08-25",1,13947,"922",909,"","Degene die bv in de Ikea moeder en zoon onthoofdde was ook een gelovige die de opdracht uit de koran uitvoerde  De     t co btTQ EADvC"
1082967332,"Oslo, Norway","RT @heyingridhey: Altså Ikea dette er jo IKKE greit https://t.co/6et8xOu1MG","2017-08-25",13,2520,"330",294,"","   Altså Ikea dette er jo IKKE greit    t co  et xOu MG"
23319109,"Oslo","RT @heyingridhey: Altså Ikea dette er jo IKKE greit https://t.co/6et8xOu1MG","2017-08-25",13,1236,"680",1001,"","   Altså Ikea dette er jo IKKE greit    t co  et xOu MG"
20627309,"Oslo","RT @ClimateReality: Going mainstream: @IKEA now sells solar panels (and batteries!) in the #UK https://t.co/hgKdNJWnQC https://t.co/roSj6Zx…","2017-08-26",34,9417,"4513",5000,"","   Going mainstream  now sells solar panels  and batteries   in the  UK    t co hgKdNJWnQC    t co roSj Zx "
152310238,"Oslo, Norway","Is anyone good at large scale jigsaw puzzles? #IKEA #kitchen https://t.co/2kRN0zmj9A","2017-08-26",0,1366,"75",213,"Place(_api=<tweepy.api.API object at 0x102826150>, country_code=u'NO', url=u'https://api.twitter.com/1.1/geo/id/e42ed02b50d62e29.json', country=u'Norway', place_type=u'city', bounding_box=BoundingBox(_api=<tweepy.api.API object at 0x102826150>, type=u'Polygon', coordinates=[[[10.4914682, 59.8097794], [10.9515836, 59.8097794], [10.9515836, 60.1350316], [10.4914682, 60.1350316]]]), contained_within=[], full_name=u'Oslo, Norway', attributes={}, id=u'e42ed02b50d62e29', name=u'Oslo')","Is anyone good at large scale jigsaw puzzles   IKEA  kitchen    t co  kRN zmj A"
275135733,"Oslo, Norway","Oh baby, we're so ready for you. #pregnant #37weeks #home⠀
⠀
⠀
#nursery #diapers #ikea… https://t.co/4WGy5LHC6k","2017-08-26",0,6201,"1642",106,"","Oh baby  we re so ready for you   pregnant   weeks  home 
 
 
 nursery  diapers  ikea     t co  WGy LHC k"
6480152,"Belgrade - Oslo","@IKEA_Srbija kada će biti u funkciji online kupovina? @IKEA_Srbija testirali smo i Windows i OSX i ne radi!","2017-08-26",0,10545,"2862",492,""," kada će biti u funkciji online kupovina  testirali smo i Windows i OSX i ne radi "
807305725890285568,"ChaoSlow","ちょっとIKEAにパンダのぬいぐるみ買いに行ってくるわ","2017-08-26",0,8074,"832",813,"","ちょっとIKEAにパンダのぬいぐるみ買いに行ってくるわ"
6480152,"Belgrade - Oslo","@IKEA_Srbija Isto na oba browsera ova informacija https://t.co/q1B0OShtDQ","2017-08-26",0,10545,"2862",492,""," Isto na oba browsera ova informacija    t co q B OShtDQ"
6480152,"Belgrade - Oslo","@IKEA_Srbija I na Macu i na Windowsu isto :(","2017-08-26",0,10545,"2862",492,""," I na Macu i na Windowsu isto   "
6480152,"Belgrade - Oslo","@IKEA_Srbija evo i direktni URL screenshota https://t.co/GrLUcSYEmO","2017-08-26",0,10545,"2862",492,""," evo i direktni URL screenshota    t co GrLUcSYEmO"
152785988,"Oslo, Norway","RT @Reidar_Svenske: @douglax @v36ar I guess you use the same image and most of the text when @IKEA have their birthday as well...","2017-08-27",1,252347,"5517",6056,""," I guess you use the same image and most of the text when have their birthday as well   "
152785988,"Oslo, Norway","@Reidar_Svenske @douglax @IKEA Wonder when @IKEA will start selling operating systems. :-)","2017-08-27",0,252347,"5517",6056,""," Wonder when will start selling operating systems     "
245287878,"Oslo, Norway","Ready for OSCAR work @Fysikk_UniOslo We're getting IKEA-style instructions for mounting the new detectors. https://t.co/RWI5oKrLGS","2017-08-28",1,8629,"657",617,"","Ready for OSCAR work We re getting IKEA style instructions for mounting the new detectors     t co RWI oKrLGS"
2182073546,"Universitetet i Oslo","RT @grymtv: Ready for OSCAR work @Fysikk_UniOslo We're getting IKEA-style instructions for mounting the new detectors. https://t.co/RWI5oKr…","2017-08-28",1,2125,"819",720,"","   Ready for OSCAR work We re getting IKEA style instructions for mounting the new detectors     t co RWI oKr "
76674896,"Oslo, Norge","@IKEANorge Er riktignok alltid på IKEA Furuset, men får alltid reaksjon på størrelsen, og i det siste også et ekstr… https://t.co/iUIKPrRsgy","2017-08-28",1,4436,"83",131,""," Er riktignok alltid på IKEA Furuset  men får alltid reaksjon på størrelsen  og i det siste også et ekstr     t co iUIKPrRsgy"
474360480,"Oslo, Norge","@kjetilbmoe Haha, er jeg kanskje litt intens angående overmadrasser? 🙈 Har per nå IKEA Tussöy, og den er kjempegod… https://t.co/4cWvOSuhIp","2017-08-28",0,19514,"671",564,""," Haha  er jeg kanskje litt intens angående overmadrasser    Har per nå IKEA Tussöy  og den er kjempegod     t co  cWvOSuhIp"
14289813,"Oslo","Angrer på at jeg leste det der om at kappene i #GameOfThrones var laget av Ikea-fuskepelser. https://t.co/Oc4SEdBrEn","2017-08-28",1,6756,"1097",1283,"","Angrer på at jeg leste det der om at kappene i  GameOfThrones var laget av Ikea fuskepelser     t co Oc SEdBrEn"
595598705,"Oslo, Norway","IKEA has me thinking about how I'm going to design and decorate my home with my family of 4 that I don't have lol.","2017-08-29",4,4285,"19217",21080,"","IKEA has me thinking about how I m going to design and decorate my home with my family of that I don t have lol "
18557630,"Oslo","feirer 32 med babysvømming, ambulanse fordi baby satt en plastbit i halsen og IKEA fordi salgsfoto i morgen. Hurra for meg. 🎉","2017-08-29",0,16956,"1049",1018,"","feirer med babysvømming  ambulanse fordi baby satt en plastbit i halsen og IKEA fordi salgsfoto i morgen  Hurra for meg   "
498251000,"Oslo","Listhaug setter Ikea-skapet på plass hos sjokkerte svensker https://t.co/s9eI4AvEOO","2017-08-29",5,92879,"3888",4105,"","Listhaug setter Ikea skapet på plass hos sjokkerte svensker    t co s eI AvEOO"
587820318,"Oslo","De veganske grønnsaksbollene fra IKEA får for lite skryt","2017-08-29",0,2191,"340",168,"","De veganske grønnsaksbollene fra IKEA får for lite skryt"
56239802,"Oslo","En kopp te og spennende materie: IKEA-katalogen #valg2017 https://t.co/spagbuX6sf","2017-08-29",0,1943,"687",1886,"","En kopp te og spennende materie  IKEA katalogen  valg    t co spagbuX sf"
466426846,"Oslo","Not a bad way to start the day with mormor #dialogkonferansen #ikea https://t.co/GMhtvE6TPj","2017-08-30",0,414,"98",275,"","Not a bad way to start the day with mormor  dialogkonferansen  ikea    t co GMhtvE TPj"
421753024,"Oslo, Norway","RT @guardiantech: Augmented reality: Apple and Google's next battleground https://t.co/gHgx1AtFIQ","2017-08-30",22,3766,"154",253,"","   Augmented reality  Apple and Google s next battleground    t co gHgx AtFIQ"
480558952,"Oslo, Norge","RT @politiOpsSTPD: Politiet ønsker vitner til et tr.uhell på IKEA 26.8 mellom kl 14-1530. En grønn bil kjørte inn i en hvit bil og forsvant…","2017-08-30",5,472617,"5018",68,"","   Politiet ønsker vitner til et tr uhell på IKEA   mellom kl     En grønn bil kjørte inn i en hvit bil og forsvant "
24154792,"Oslo, Norway","RT @wearethetin: Ikea steps into #AR with a revolutionary try-before-buy furniture app https://t.co/x29aNuhvLu #tech","2017-08-30",5,1645,"460",495,"","   Ikea steps into  AR with a revolutionary try before buy furniture app    t co x aNuhvLu  tech"
2507750199,"Oslo, Norway","@vartdal 😅😅no that I actually bought from IKEA! She gave me her keyboard as it was otherwise going to waste! 😀","2017-08-30",0,9750,"221",109,"","   no that I actually bought from IKEA  She gave me her keyboard as it was otherwise going to waste   "
480558952,"Oslo, Norge","RT @Rogalandops: 02:50-03:40 
Innbrudd v Europris, Forus, 
og innbrudd i 2 biler v parkeringsplass nær Ikea.
Patr på stdt, har undersøkt ås…","2017-08-31",2,472617,"5018",68,"","         
Innbrudd v Europris  Forus  
og innbrudd i biler v parkeringsplass nær Ikea 
Patr på stdt  har undersøkt ås "
338557070,"Oslo","@Trond68 Neida. Det kommer flatpakket fra IKEA i kveld, så skal de montere det i morgen.","2017-08-31",0,20407,"2286",2566,""," Neida  Det kommer flatpakket fra IKEA i kveld  så skal de montere det i morgen "
818851983788560384,"Oslo, Norway","#Bærekraft i praksis = @ikea @YngvillOfstad @CathrineBarth @monhes @JannickeH See @norway's #green #startups portal… https://t.co/s9lefHzUmW","2017-08-31",3,1167,"384",988,""," Bærekraft i praksis   See  s  green  startups portal     t co s lefHzUmW"
2820809057,"Oslo, Norway","Blir sliten av IKEA ass!😩💦
.
#ikea #karve #carlings #vlog #youtuber #vailent #vans #offthewall… https://t.co/9GQeBRWnW5","2017-08-31",1,1198,"897",48,"","Blir sliten av IKEA ass   
 
 ikea  karve  carlings  vlog  youtuber  vailent  vans  offthewall     t co  GQeBRWnW "
2820809057,"Oslo, Norway","Blir sliten av IKEA ass!😩💦
.
#ikea #karve #carlings #vlog #youtuber #vailent #vans #offthewall… https://t.co/9GQeBRWnW5","2017-08-31",1,1201,"898",48,"","Blir sliten av IKEA ass   
 
 ikea  karve  carlings  vlog  youtuber  vailent  vans  offthewall     t co  GQeBRWnW "
21608847,"Oslo, Norway","Sverige har Ikea, #Norge har OLJE! De bryr seg om folk, vi bør beskytte oss selv! Bygg vegger! Vær som Texas og Trump! #valg2017 alt-#Høyer","2017-09-01",0,92,"19",12,"","Sverige har Ikea   Norge har OLJE  De bryr seg om folk  vi bør beskytte oss selv  Bygg vegger  Vær som Texas og Trump   valg alt  Høyer"
21608847,"Oslo, Norway","Sverige har Ikea, #Norge har OLJE! De bryr seg om folk, vi bør beskytte oss selv! Bygg vegger! Vær som Texas og Trump! #valg2017 alt-#Høyer","2017-09-01",0,121,"20",18,"","Sverige har Ikea   Norge har OLJE  De bryr seg om folk  vi bør beskytte oss selv  Bygg vegger  Vær som Texas og Trump   valg alt  Høyer"
3428382707,"Oslo, Norway","@YoSoyJayJayMX Cumplo requisitos but no soy un catálogo de IKEA ok","2017-09-01",0,8389,"372",480,""," Cumplo requisitos but no soy un catálogo de IKEA ok"
3428382707,"Oslo, Norway","@YoSoyJayJayMX Cumplo requisitos but no soy un catálogo de IKEA ok","2017-09-01",0,8437,"365",486,""," Cumplo requisitos but no soy un catálogo de IKEA ok"
4033980430,"Vosloorus, South Africa","RT @mypublicnudity: Flashing in IKEA store
#publicnudity https://t.co/iVh1G0vM7N","2017-09-02",132,753,"67",466,"","   Flashing in IKEA store
 publicnudity    t co iVh G vM N"
32415387,"Oslo, Norway","Hallo! Jeg ba om en ganske enkel skjorte, ikke et helt byggesett fra IKEA! #innpakkingssløseri https://t.co/D2EBoh56TE","2017-09-02",0,674,"280",394,"","Hallo  Jeg ba om en ganske enkel skjorte  ikke et helt byggesett fra IKEA   innpakkingssløseri    t co D EBoh TE"
32415387,"Oslo, Norway","Hallo! Jeg ba om en ganske enkel skjorte, ikke et helt byggesett fra IKEA! #innpakkingssløseri https://t.co/D2EBoh56TE","2017-09-02",0,677,"285",395,"","Hallo  Jeg ba om en ganske enkel skjorte  ikke et helt byggesett fra IKEA   innpakkingssløseri    t co D EBoh TE"
2709506948,"Norway - Oslo","RT @Akitadoggers: @Lionel_Toy IKEA LION https://t.co/KM096Xg2kz","2017-09-02",2,7294,"422",930,""," IKEA LION    t co KM Xg kz"
2709506948,"Norway - Oslo","RT @Akitadoggers: @Lionel_Toy IKEA LION https://t.co/KM096Xg2kz","2017-09-02",2,7367,"419",930,""," IKEA LION    t co KM Xg kz"
2529448860,"Oslo","Lurer på om de selger bilder av Barcode skylinen på IKEA i New York.","2017-09-02",0,661,"1496",186,"","Lurer på om de selger bilder av Barcode skylinen på IKEA i New York "
59476266,"Oslo, Norge","RT @_CocoCosta: Um gajo não pode ver um catálogo do Ikea sem imaginar uma vida a dois, filhos, cão, netos, um periquito e um hamster","2017-09-02",17,14071,"249",448,"","   Um gajo não pode ver um catálogo do Ikea sem imaginar uma vida a dois  filhos  cão  netos  um periquito e um hamster"
59476266,"Oslo, Norge","RT @_CocoCosta: Um gajo não pode ver um catálogo do Ikea sem imaginar uma vida a dois, filhos, cão, netos, um periquito e um hamster","2017-09-02",34,14145,"253",448,"","   Um gajo não pode ver um catálogo do Ikea sem imaginar uma vida a dois  filhos  cão  netos  um periquito e um hamster"
14361246,"Oslo","I avdelingen for HMS-problemer. https://t.co/8vOncAqEjB","2017-09-03",0,13988,"525",1618,"","I avdelingen for HMS problemer     t co  vOncAqEjB"
768362079615127552,"Oslo, Norway","H&amp;amp;M og Ikea samarbeider om ny type klær - https://t.co/OOUYxziKb5 av Sveriges største selskaper har i stillhet gått sammen og startet...","2017-09-03",0,37075,"158",665,"","H  amp M og Ikea samarbeider om ny type klær      t co OOUYxziKb av Sveriges største selskaper har i stillhet gått sammen og startet   "
737177873853886464,"Oslo, Norge","H&amp;amp;M og Ikea samarbeider om ny type klær - https://t.co/grw1WyOdZ0 av Sveriges største selskaper har i stillhet gått sammen og startet...","2017-09-03",0,78825,"424",2222,"","H  amp M og Ikea samarbeider om ny type klær      t co grw WyOdZ av Sveriges største selskaper har i stillhet gått sammen og startet   "
169271314,"Oslo, Norway","@kbiegel Ah. For being Hell on Earth, IKEA got some good shit.","2017-09-03",0,43856,"2000",2384,""," Ah  For being Hell on Earth  IKEA got some good shit "
22913316,"Oslo","H&amp;M + IKEA = sant #nyheter # #msn https://t.co/bRejeBSPWE https://t.co/zzJwvzcEln","2017-09-03",0,10200,"1269",663,"","H  M   IKEA   sant  nyheter    msn    t co bRejeBSPWE    t co zzJwvzcEln"
2169679552,"Oslo, Norway","@DM_ME_YOUR_CATS IKEA is life. 
Jeg trenger litt gul og blå nå kjenner jeg.","2017-09-04",0,16868,"1022",318,""," IKEA is life  
Jeg trenger litt gul og blå nå kjenner jeg "
753670957504532480,"Oslo, Norway","RT @TheVampsJames: All these other artists landing Nike and Ferrari brand deals whilst I'm here like hook me up with John Lewis &amp; Ikea.","2017-09-04",1042,548,"37",179,"","   All these other artists landing Nike and Ferrari brand deals whilst I m here like hook me up with John Lewis   Ikea "
857047802,"Oslo, Norge","RT @Jordan_Coombe: I have been at ikea for 5 minutes and I'm already planning my future house for a family of 4 that doesn't even fucking e…","2017-09-04",2454,5587,"170",199,"","   I have been at ikea for minutes and I m already planning my future house for a family of that doesn t even fucking e "
2381703522,"OSLO","Hverdagen kan være utfordrende | IKEA

#norway #nature #visitnorway #oslo #natur #utno… https://t.co/QkBdSZj9gK","2017-09-05",0,298,"114",363,"","Hverdagen kan være utfordrende   IKEA

 norway  nature  visitnorway  oslo  natur  utno     t co QkBdSZj gK"
2381703522,"OSLO","Hverdagen kan være utfordrende | IKEA

#norway #nature #visitnorway #oslo #natur #utno #mittnorge #norge #sommer... https://t.co/JKDJmW8Crr","2017-09-05",0,298,"114",363,"","Hverdagen kan være utfordrende   IKEA

 norway  nature  visitnorway  oslo  natur  utno  mittnorge  norge  sommer       t co JKDJmW Crr"
2381703522,"OSLO","Hverdagen kan være utfordrende | IKEA https://t.co/519mY79L0N https://t.co/CaeWkWIqnJ","2017-09-05",0,298,"114",363,"","Hverdagen kan være utfordrende   IKEA    t co  mY L N    t co CaeWkWIqnJ"
4559003139,"Oslo, Norway","@abvndbynd Yeah haha it's Ikea grade shit, only with like 4000 parts... I've only found a few and those guys are as… https://t.co/27x3Z4Kl7x","2017-09-05",0,3444,"75",219,""," Yeah haha it s Ikea grade shit  only with like parts    I ve only found a few and those guys are as     t co  x Z Kl x"
480253925,"Asker, Bærum og Oslo","Mindre materielle skader men trafikken går sakte forbi stedet. Dette er inngående ved Ikea.","2017-09-06",2,8845,"102364",12,"","Mindre materielle skader men trafikken går sakte forbi stedet  Dette er inngående ved Ikea "
480558952,"Oslo, Norge","RT @Oslo110sentral: Mindre materielle skader men trafikken går sakte forbi stedet. Dette er inngående ved Ikea.","2017-09-06",2,475124,"5036",68,"","   Mindre materielle skader men trafikken går sakte forbi stedet  Dette er inngående ved Ikea "
47317899,"Oslo, Norge","@forsberg @fuchsiablix @eivindtraedal https://t.co/6ObUKWyvJI","2017-09-06",0,28165,"17641",1316,"","    t co  ObUKWyvJI"
786883412909035520,"Oslo, Norge","Sitter ved siden av hverandre i sofaen. 
Meg: Skal vi ta en tur på #IKEA i dag? 
Han: Ja, når skal jeg hente deg?","2017-09-06",4,67,"119",392,"","Sitter ved siden av hverandre i sofaen  
Meg  Skal vi ta en tur på  IKEA i dag  
Han  Ja  når skal jeg hente deg "
19140661,"Oslo","RT @susvedvik: Sitter ved siden av hverandre i sofaen. 
Meg: Skal vi ta en tur på #IKEA i dag? 
Han: Ja, når skal jeg hente deg?","2017-09-06",4,30523,"2746",3068,"","   Sitter ved siden av hverandre i sofaen  
Meg  Skal vi ta en tur på  IKEA i dag  
Han  Ja  når skal jeg hente deg "
41124241,"Norway, Oslo","RT @susvedvik: Sitter ved siden av hverandre i sofaen. 
Meg: Skal vi ta en tur på #IKEA i dag? 
Han: Ja, når skal jeg hente deg?","2017-09-06",4,55165,"2924",1810,"","   Sitter ved siden av hverandre i sofaen  
Meg  Skal vi ta en tur på  IKEA i dag  
Han  Ja  når skal jeg hente deg "
27539402,"Oslo, Norge","@Ruter Fullt trafikkaos i Fred Olsensgt fordi tre-fire busser konkurrerer med IKEA-buss om frimerkeholdeplass. Finn mer intelligent løsning?","2017-09-06",0,11197,"4954",3961,""," Fullt trafikkaos i Fred Olsensgt fordi tre fire busser konkurrerer med IKEA buss om frimerkeholdeplass  Finn mer intelligent løsning "
1830082674,"Oslo, Norway","I added a video to a @YouTube playlist https://t.co/0pXNxyx3oy EXTREME IKEA MAKEOVER!","2017-09-07",0,881,"47",100,"","I added a video to a playlist    t co  pXNxyx oy EXTREME IKEA MAKEOVER "
38033026,"Oslo, Norway","RT @GussyRiot: Mina tankar går till kvinnan i IKEA-katalogen med tre ben. https://t.co/LQOMrxxJlP","2017-09-07",12,30342,"1210",1150,"","   Mina tankar går till kvinnan i IKEA katalogen med tre ben     t co LQOMrxxJlP"
125420403,"Oslo/Brumunddal","RT @EllAnden: Alt går så fort i vår tid. Allerede nå inviterer IKEA til 'tradisjonell, norsk taco'.","2017-09-07",3,5898,"521",1180,"","   Alt går så fort i vår tid  Allerede nå inviterer IKEA til  tradisjonell  norsk taco  "
857920268181921792,"Oslo, Norway","@hm og @IKEA sammen om å utvikle miljøvennlig tekstilfiber fra cellulose. Herlig! #samarbeid #sirkulærøkonomi https://t.co/EKVtjbaoK8","2017-09-07",0,44,"36",99,""," og sammen om å utvikle miljøvennlig tekstilfiber fra cellulose  Herlig   samarbeid  sirkulærøkonomi    t co EKVtjbaoK "
900363562798985216,"Oslo, Norway","@mohnagt @isabelleAGT @christofferAGT @florence_AGT @JaureguiAGT si, l'ikea l'ho inventato io","2017-09-07",0,802,"81",62,""," si  l ikea l ho inventato io"
2212750405,"Innsbruck/Ruhpolding/Oslo","RT @psychospaghetti: Mieszkania studenckiego dzielą się na 2 standardy: 
PRL i IKEA","2017-09-07",696,94588,"4908",2571,"","   Mieszkania studenckiego dzielą się na standardy  
PRL i IKEA"
1016124848,"Pachecoslovaquia","RT @TONICRUZ1: Podemos ir a votar al Ikea. Tenemos las papeletas, tenemos los lápices y estaremos más cerca de la República Independiente","2017-09-07",7801,7779,"164",113,"","   Podemos ir a votar al Ikea  Tenemos las papeletas  tenemos los lápices y estaremos más cerca de la República Independiente"
806957876136841216,"Oslo, Norway","Ikea bag filled with human skeletons

https://t.co/PXsfsfudzf","2017-09-07",0,354,"4744",3287,"","Ikea bag filled with human skeletons

    t co PXsfsfudzf"
14378181,"Oslo","Har vært på Ikea igjen, og for første gang i mitt liv kun kjøpt akkurat den ene tingen jeg skulle kjøpe der og ikke noe mer.","2017-09-07",0,22858,"3133",4100,"","Har vært på Ikea igjen  og for første gang i mitt liv kun kjøpt akkurat den ene tingen jeg skulle kjøpe der og ikke noe mer "
14113997,"Oslo, Norway","Interessant (og morsomt)! https://t.co/Zb6g8jutma","2017-09-08",0,1738,"1049",1371,"","Interessant  og morsomt      t co Zb g jutma"
61594707,"Oslo","RT @jonoduffy: The wizzair terminal looks like the warehouse at IKEA. Next we assemble the plane. https://t.co/rM8Uf1xPz8","2017-09-08",2,6224,"333",683,"","   The wizzair terminal looks like the warehouse at IKEA  Next we assemble the plane     t co rM Uf xPz "
96739600,"Oslo, Europa","Sitter på banen blant 8 tenåringsjenter, det er som å sitte i duftlysavdelingen på IKEA.","2017-09-09",0,6529,"585",647,"","Sitter på banen blant tenåringsjenter  det er som å sitte i duftlysavdelingen på IKEA "
1604023051,"Oslo, Norge","RT @richardosman: The secret to happiness is that, whatever you're doing, remember you could be in IKEA on a Saturday instead.","2017-09-09",976,194,"26",318,"","   The secret to happiness is that  whatever you re doing  remember you could be in IKEA on a Saturday instead "
1604023051,"Oslo, Norge","RT @richardosman: The secret to happiness is that, whatever you're doing, remember you could be in IKEA on a Saturday instead.","2017-09-09",1041,196,"26",318,"","   The secret to happiness is that  whatever you re doing  remember you could be in IKEA on a Saturday instead "
91681338,"Oslo","RT @dezeen: In the future, will we eat meatballs made from crispy insect protein?
https://t.co/GLTD1I4TYO","2017-09-10",13,1158,"126",323,"","   In the future  will we eat meatballs made from crispy insect protein 
    t co GLTD I TYO"
452978753,"Oslo, Norway","RT @hibpo: IKEA House @ Taipei คาเฟ่ของ IKEA เหมือนได้เอาของเข้าไปกินในดิสเพล์ เท่มากก มีโซนห้องนั่งเล่น ห้องนอน ห้องเด็ก ห้องครัว ห้องทำงา…","2017-09-10",12785,199935,"472",462,"","   IKEA House   Taipei คาเฟ่ของ IKEA เหมือนได้เอาของเข้าไปกินในดิสเพล์ เท่มากก มีโซนห้องนั่งเล่น ห้องนอน ห้องเด็ก ห้องครัว ห้องทำงา "
392045287,"Oslo, Norge","RT @TirillHeimdal: Er på IKEA.
Later som eg tester ein stol, men eg har eigentleg gitt opp. 

Trur eg er ein mann i 40-åra mentalt.","2017-09-11",2,69679,"5919",4446,"","   Er på IKEA 
Later som eg tester ein stol  men eg har eigentleg gitt opp  

Trur eg er ein mann i  åra mentalt "
805450,"Oslo, Norway","@Chronoo I have a Swedish colleague now! Time to brush up on my Swedish. ""Hej"", ""Kjøttbullar"", ""ABBA"", ""IKEA"".","2017-09-11",0,7170,"599",549,""," I have a Swedish colleague now  Time to brush up on my Swedish   Hej    Kjøttbullar    ABBA    IKEA  "
21267710,"oslo 🇳🇴, seattle 🇺🇸","@johninmpls @IKEA kallax is so perfect","2017-09-11",0,47489,"629",1171,""," kallax is so perfect"
2212750405,"Innsbruck/Ruhpolding/Oslo","RT @tomhanksmyking: Czy twoje oczy to IKEA? Bo się w nich zgubiłem","2017-09-12",766,95181,"4924",2593,"","   Czy twoje oczy to IKEA  Bo się w nich zgubiłem"
396473214,"Oslo, Norway","RT @dylanjakemorris: Javert: AND I AM JAVERT, DO NOT FORGET MY NAME
IKEA: got it https://t.co/6Zmq88quRq","2017-09-12",14445,174,"30",191,"","   Javert  AND I AM JAVERT  DO NOT FORGET MY NAME
IKEA  got it    t co  Zmq quRq"
381502681,"Oslo politidistrikt","IKEA Furuset.  Et tre har falt ut i veien ved bussholdeplassen. Trafikken flyter greit forbi.","2017-09-12",0,43654,"320950",17,"","IKEA Furuset  Et tre har falt ut i veien ved bussholdeplassen  Trafikken flyter greit forbi "
480558952,"Oslo, Norge","RT @oslopolitiops: IKEA Furuset.  Et tre har falt ut i veien ved bussholdeplassen. Trafikken flyter greit forbi.","2017-09-12",0,476597,"5044",68,"","   IKEA Furuset  Et tre har falt ut i veien ved bussholdeplassen  Trafikken flyter greit forbi "
354911701,"Oslo, Norway ","RT @dylanjakemorris: Javert: AND I AM JAVERT, DO NOT FORGET MY NAME
IKEA: got it https://t.co/6Zmq88quRq","2017-09-12",14444,7475,"107",213,"","   Javert  AND I AM JAVERT  DO NOT FORGET MY NAME
IKEA  got it    t co  Zmq quRq"
